{
  "$schema_version": 1,
  "$generated_at": "2026-05-14T00:00:00Z",
  "$source": "minimal cold-start baseline (mirrors crates/blazen-llm/src/pricing.rs default_pricing() before build.rs introduction). The full live catalog lives on the `models-data` branch and at https://blazen.dev/api/pricing.json — call refresh_default() at app startup to load it.",
  "models": {
    "gpt-4.1":                       { "input_per_million": 2.0,   "output_per_million": 8.0 },
    "gpt-4.1-mini":                  { "input_per_million": 0.40,  "output_per_million": 1.60 },
    "gpt-4.1-nano":                  { "input_per_million": 0.10,  "output_per_million": 0.40 },
    "gpt-4o":                        { "input_per_million": 2.50,  "output_per_million": 10.0 },
    "gpt-4o-mini":                   { "input_per_million": 0.15,  "output_per_million": 0.60 },
    "o3":                            { "input_per_million": 10.0,  "output_per_million": 40.0 },
    "o4-mini":                       { "input_per_million": 1.10,  "output_per_million": 4.40 },
    "claude-sonnet-4":               { "input_per_million": 3.0,   "output_per_million": 15.0 },
    "claude-opus-4":                 { "input_per_million": 15.0,  "output_per_million": 75.0 },
    "claude-haiku-4":                { "input_per_million": 0.80,  "output_per_million": 4.0 },
    "gemini-2.5-flash":              { "input_per_million": 0.15,  "output_per_million": 0.60 },
    "gemini-2.5-pro":                { "input_per_million": 1.25,  "output_per_million": 10.0 },
    "llama-3.3-70b-versatile":       { "input_per_million": 0.59,  "output_per_million": 0.79 },
    "llama-3.3-70b-instruct-turbo":  { "input_per_million": 0.88,  "output_per_million": 0.88 },
    "deepseek-chat":                 { "input_per_million": 0.27,  "output_per_million": 1.10 },
    "mistral-large-latest":          { "input_per_million": 2.0,   "output_per_million": 6.0 },
    "grok-3":                        { "input_per_million": 3.0,   "output_per_million": 15.0 },
    "sonar-pro":                     { "input_per_million": 3.0,   "output_per_million": 15.0 },
    "command-a":                     { "input_per_million": 2.50,  "output_per_million": 10.0 }
  }
}
